<!ELEMENT chat (author, message*)>
<!ELEMENT author (name, avatar)>
<!ELEMENT name (#PCDATA)>
<!ELEMENT avatar (#PCDATA)>
<!ELEMENT message (date, text)>
<!ATTLIST message mine (yes no)>
<!ELEMENT text (#PCDATA)>
<!ELEMENT date (#PCDATA)>
